index,genre,filename,year,old_index,source1,source2,Sentence1,Sentence2,Similarity
29,Forum,Anonymous,2023,1,NewsForums,DiscussionForums,"Working in Health and Social care for over 20 years the amount off people I have met who care for loved ones and they don't get a break. Good on you Kate and for taking your daughter! Working, being a parent, wife and carer, people shouldn't judge till they have walked in your shoes. Best wishes xx","I'll wait until I see it. This guy gives out that much misinformation and cryptic messages you have to take what he says with a large pinch of salt. He is actually the architect of high inflation in the UK. A man add icted to printing more new money when any problem occurs. I actually put more blame at his door than someone like Truss who was naive as to the po or state of the economy caused by cheap money leading to uncontrolled inflation and a weak pound. Its inflation which is the real da nger to the UK and anyone who does any shopping for food, clothes etc knows its not 9.9 percent, more like 30 percent plus. Another thing about this guy, he has just given this message about rates going up higher than expected. This will pushed the pound up a few percent against the dollar. When the MPC meet I bet they increase by a much smaller amount and that will lead to a very large drop in the pound. Guy is a me nace.",0.002690171
30,Forum,Anonymous,2023,1,NewsForums,DiscussionForums,"Lovely to see them out having fun. Obviously it's a worry for him to be needing the extra care, but sometimes it must come as a relief for her to know that someone else is responsible for his life, it's not always her call. I know she has carers but ultimately, when he's home she'll always feel that weight.","High inflation and massive pay rises are great for folk who don't have a mortgage, or just a small mortgage (mine is 45k base rate + 0.55% tracker, some got better then that in 2006 when the banks were throwing silly money at folk and allowing them to self-certify their salaries, but my current account fully offsets my mortgage so I'm paying zero interest).",0.006790634
31,Forum,Anonymous,2023,1,NewsForums,DiscussionForums,"I've been through this situation. My dad was in and our of hospital for years with cancer. He would say, 'go out, take a break from this, I would if I could, everyone needs a break'. Sometimes I did. Leave them alone. Unless you've been through it, you can't imagine how awful it is. You feel like you are living in fog constantly. You aren't living when something like this is going on in your life.","Unfortunately all these families living way beyond their means are going to struggle. Do you really need that 4x4 to drop your kids off at school, multiple holidays a year, new phones every 2 years. Unfortunately people of today are obsessed with impressing people they dont even know so they can post it on social media.",0.1126526
32,Forum,Anonymous,2023,1,NewsForums,DiscussionForums,"Nice to see Kate having some fun. People slam her but shes gone from being a wife to being a carer which is a lonely and difficult road for both her and her husband. Im sure hed be happy to see her having a nice time, its an awful situation for both of them and hope his health improves.","He's obviously been given advanced sight of the inflation figures for September, due for publication on 19th. October. They must be pretty high and the reason we're being softened up by the Government (via the Governor of the BoE) for a large hike in interest rates to try and control it.",0.02705575
33,Forum,Anonymous,2023,1,NewsForums,DiscussionForums,"Anyone willing to report on the massive news that the European Parliament called a press conference (No press turned up, by the look of it) regarding Pfizer, Moderna, et al's accountability for their lies around the vaccines safety and efficacy during the pandemic? Calls for a full enquiry. It's almost as if the press is mostly bought and paid for by big pharma. Before you start with the pathetic 'tin foil hat' comments, at least watch on YT. Search Cristian Terhes.","The rising prices cannot be halted simply by impoverishing the people, it is caused by shortages of supply. The shortages of supply could be greatly eased if the governments settled their differences through negotiation. As long as we have war we will see things getting worse.",0.10686823
34,Forum,Anonymous,2023,1,NewsForums,DiscussionForums,"I am listening to a live interview with Dr. Roger Hodkinson in Canada. The interviewer just asked him when he is talking privately with the other well-known doctors about where this is going what do really they think is going to happen. Hodkinson responded that he won't say who the doctor is but someone who is connected to the 3-letter agencies and to the Trump Task Force, ""who is very honourable"", says that he expects ""a massive die-off in 5 years.""","Savers have been forced to subsidise mortgages, credit for far too long. It was totally unrealistic and about time the balance tipped. What I don't understand here is why mortgages are short term like 2 years when the liability is 25 years. There is no reason why long term fixed mortgages could not have been offered, giving mortgage owners certainty. The bankers are just interested in fees.",0.062226307
35,Forum,Anonymous,2023,1,NewsForums,DiscussionForums,We have not got covid but all the family hit by an awful cold infection which has knocked us all for six. From the baby at3 years old to the eldest at 67 we have all been floored. Came via three year old from nursery and we have all had varying degrees of yuk from awfulness to bad chest infections. No runny noses just wiped out and left with awful coughs. My daughter says it's rife in the Southend On Sea areas as well. It's not just covid this year but loads of nasties we haven't had before are out there..,"And more and more fools cant seem to connect the dots as to why people are genuinely concerned about even a small increase in interest rates. Rising costs of fuel, energy and food at the same time as rising interest rates is destroying peoples finances. Not purely the interest rates. We knew rates would go up so many wouldnt have stretched too far. But who on earth could think all this mess would happen at the same time in a matter of months?",0.088582717
36,Forum,Anonymous,2023,1,NewsForums,DiscussionForums,"@MJ: 6 million who died of absolutely anything, within 28 days of a positive test result, from a worthless test, which was never meant to be used as a test, or as any indication of infection for any disease, because of mostly false positives, It doesn't test for just Covid 19, but for any coronavirus related material, even non active coronavirus from past infections , ect, Fruit is testing positive for Covid 19 using this test, which is impossible, Maybe all fruit should be vaccinated with the clotshot? Nobody in the world has yet provided a purified, isolated sample of Covid 19, ever, Only thing that comes back in the samples is Flu type A, or Flu type B, It exists only on a computer model, People get flu & die every year, nobody cares.. & if it's so infectious & deadly, why haven't had it? & why am I not dead? You've been had..","Highest Leave and Remain votes in 2016 EU referendum. Leave: Boston - average house price 182K Remain: Lambeth - average house price 650k These interest rate hikes are going to hit the Remain voting areas HARD. I'm so chuffed, this is such a worthy punishment for them. Brexit just doesn't stop giving.",0.030655313
37,Forum,Anonymous,2023,1,NewsForums,DiscussionForums,"We are a three-person household and we've all recently had covid. Two of us are vaxxed, one isn't. Two of us had extremely mild symptoms, one had slightly worse symptoms and for longer. Two of us enjoyed a 10-day holiday in Spain after testing negative. Now two of us are being bombarded with texts and emails asking us to get this new booster. Why? We all surely have natural immunity from the real thing and the new booster can't predict what the next variant will be. It's a big no from two of us. Enough is enough.","Ridiculously low interest rates, plus central banks printing untold money has created both inflation and an asset bubble. Sadly, there will be now casualties as people will struggle to meet mortgages, and businesses will struggle to finance their loans and meet their cash flow responsibilities. Back in 2008, the global economy needed a reset, rather than a can kicking exercise to avoid economic reality. Buckle up people - spend less, earn more. Take a second job if need be, as there be at least a couple of years of harder times ahead.",0.228981331
38,Forum,Anonymous,2023,1,NewsForums,DiscussionForums,After Pfizer admitting the jab was never tested against transmission why aren't the media asking why we were lie'd to by our government and their so called expert's. Why was it so important to try and get a 100% of the population jabed and why are they not reporting on the harm that's been caused by this jab and the access death's we are seeing that have nothing to do with COVID. We don't seem to be able to trust anyone to tell the truth.,They kicked the housing can down the road for a decade. Now all the pain comes at once. The worst thing about it all is that everyone including the media and government - have essentially been saying get on the ladder at any cost. They've tricked people into a lifetime of debt for a house that will soon be worth 50% what they paid.,0.221636519
39,Forum,Anonymous,2023,1,NewsForums,DiscussionForums,"Incredible that the huge bombshell dropped by the Pfizer exec is still being supressed, as if it's just going to go away. The longer it's not reported, the more evident it becomes how this ra/g and the rest of the MSM are t reac erous pro. p agan dists doing their masters' will. How can you sit on a massive story like that in a vain attempt to protect the establishment, when it's common knowledge? The press have reached previously unplumbed depths of dis/. graceful behaviour this time.","He's obviously been given advanced sight of the inflation figures for September, due for publication on 19th. October. They must be pretty high and the reason we're being softened up by the Government (via the Governor of the BoE) for a large hike in interest rates to try and control it.",0.184428811
40,Forum,Anonymous,2023,1,NewsForums,DiscussionForums,"In 1992 164 countries agreed to reduce the world's population to 800million by 2030. This started as agenda 21 and agenda 2030 was added after the agreement. The jabs are the globalists route to a mass die off of the elderly first then onto middle aged then working down, all under the guise of, there's another strain bs, take more jabs. Unfortunately for them, this has caused a mass awakening of people to now start questioning what the hell is going on. The globalists have lost, the triple jabbed will be gone, those of us who remain will continue en masse to say no. Mass non compliance is how we beat this evil.","Savers have been forced to subsidise mortgages, credit for far too long. It was totally unrealistic and about time the balance tipped. What I don't understand here is why mortgages are short term like 2 years when the liability is 25 years. There is no reason why long term fixed mortgages could not have been offered, giving mortgage owners certainty. The bankers are just interested in fees.",0.200656757
41,Forum,Anonymous,2023,1,NewsForums,DiscussionForums,"@mrshoneyman No, Anna is spot on exposing this world-wide con. Ask yourself where this 'deadly virus' came from; who paid for its development and who took a patent out on it. Do you really believe that billionaires want us around? Why does Bill Gates want a global population of just half a billion (as opposed to the 9 billion we have) and call us 'useless eaters'? Why do we have 1600 excess deaths a week in this country now, particularly in the younger age groups and unrelated to Covid - could not possibly be the miracle 'cure' for a deadly virus where the survival rate is 99.7 per cent and the AVERAGE age of death is greater than that normally expected prior to this pandemic could it? Anna is right. Pfizer have now had to admit that they never tested whether their jab would prevent transmission to others - in other words, my children were coerced into taking something so that they could keep their jobs and travel - it was never to save the lives of others. Anna has sense!","And more and more fools cant seem to connect the dots as to why people are genuinely concerned about even a small increase in interest rates. Rising costs of fuel, energy and food at the same time as rising interest rates is destroying peoples finances. Not purely the interest rates. We knew rates would go up so many wouldnt have stretched too far. But who on earth could think all this mess would happen at the same time in a matter of months?",0.323579222
42,Forum,Anonymous,2023,1,NewsForums,DiscussionForums,"Study finds 84% increase in incidence of cardiac-related DEATH among men under 40 following mRNA vaccination Florida Department of Health (FDOH) has found that men under 40 are at high risk of experiencing cardiac-related death after taking the mRNA Wuhan coronavirus (COVID-19) vaccines. According to a statewide study headed by Florida Surgeon General Dr. Joseph A. Ladapo, there was an 84 percent increase in the relative incidence of cardiac-related deaths among males aged 18 to 39 within 28 days following mRNA vaccination. The study investigated vaccinated Florida residents aged 18 and older.","Highest Leave and Remain votes in 2016 EU referendum. Leave: Boston - average house price 182K Remain: Lambeth - average house price 650k These interest rate hikes are going to hit the Remain voting areas HARD. I'm so chuffed, this is such a worthy punishment for them. Brexit just doesn't stop giving.",0.045379911
43,Forum,Anonymous,2023,1,NewsForums,DiscussionForums,"I am 63 my missies 53 no jabs, partied mixed and mingled for 3 years not a cough or cold, my daughter son and sister badgered us to get the jab, sister went to AE 2 days after her 2nd, severe headache and sight problems, daughter bed bound for 10 days after her third jab, I`m a cynical old goat but all this pressure to get it by the Government and msm seemed off to me, seems to be a lot of youngish kids dying recently","Ridiculously low interest rates, plus central banks printing untold money has created both inflation and an asset bubble. Sadly, there will be now casualties as people will struggle to meet mortgages, and businesses will struggle to finance their loans and meet their cash flow responsibilities. Back in 2008, the global economy needed a reset, rather than a can kicking exercise to avoid economic reality. Buckle up people - spend less, earn more. Take a second job if need be, as there be at least a couple of years of harder times ahead.",0.174183056
44,Forum,Anonymous,2023,1,NewsForums,DiscussionForums,We 'Conspiracy Theorists' told you in 2020 there would be endless jabs and that over time it would keep the virus mutating to avoid the 'vaccines'. We also told you it would create vaccine passports. We told you so many thing that have come true (we also denied the disinformation crowd that threw in 5G and nanochip nonsense to try and muddy the water). Yet here we are.,They kicked the housing can down the road for a decade. Now all the pain comes at once. The worst thing about it all is that everyone including the media and government - have essentially been saying get on the ladder at any cost. They've tricked people into a lifetime of debt for a house that will soon be worth 50% what they paid.,0.102647327
45,Forum,Anonymous,2023,1,NewsForums,DiscussionForums,"Unvaxxed! Keep a diary of videos, photos etc of Pro vaxxers that hated on unvaxxed. You are in for the biggest lawsuit in history. Cristian Terhes MEP I need your help! Can you comment to this tweet with links to statements from or clips with public figures claiming that the COVID vaccines are stopping the transmission / spread of the virus? Their lies and disinformation must be exposed!",Sovereignty was one of the biggest Brexit lies. If this crisis shows us anything it's that we're at the mercy of World political and economic events that we have little or no control over and being outside of a large trading bloc more powerless than ever when it comes to our voice being heard.,0.065548182
46,Forum,Anonymous,2023,1,NewsForums,DiscussionForums,This WEF human augmentation injection has killed n maimed a generation. For a flu that 99.8% survived via natural immune system. That includes those hospitalised & vulnerable. This was NEVER about a flu. Boris has already signed YOUR right for bodily autonomy to elected elitist WHO. Without your consent . Proper science n medical advice ignored. Structures in place to control . Facial recognition & conditions to travel. All sinister and satanic even.,"Brexit Britain now faces a Bond crisis, which will cause a currency crisis, which will cause a mortgage crisis, which will trigger a banking crisis and therefore turn the UK into the Sri Lanka of Europe. Not to worry. According to Private Wealth Investment Fund Operator Lord Snooty you never really had it. You didn't earn it. You didn't need it anyway, and you will be happy because thanks to Brexit you can have a free bellyful of delicious SOVERIGNTY for yourself, and for that Unicorn in your front garden. - just as previous generations were fed the lie that this world is not important - the next world is important, while the established churches accumulated obscene wealth. There will be absolute hell to pay for Brexit.",0.173634544
47,Forum,Anonymous,2023,1,NewsForums,DiscussionForums,"Just confirmed with covid. Don't let the sniffles lot kid you on. Been in bed three days, with hot and cold temperature, massive cough, sneezing and painful eyes at times. I have had three jabs. I feel awful. I'm 58 with no underlying conditions. Even if you don't feel much please wear a mask in busy areas. You might save someone else's life. Its still an unpleasant virus for some.","Just confirmed with covid. Don't let the sniffles lot kid you on. Been in bed three days, with hot and cold temperature, massive cough, sneezing and painful eyes at times. I have had three jabs. I feel awful. I'm 58 with no underlying conditions. Even if you don't feel much please wear a mask in busy areas. You might save someone else's life. Its still an unpleasant virus for some.",0.956
48,Forum,Anonymous,2023,1,NewsForums,DiscussionForums,"If you have the jab, they will use it to instill fear in people again. They will report daily deaths and use it as an excuse to cancel everything, cancel Christmas, shut the pubs, ban gatherings. This social experiment has to end and we must never return to those dark days. The mental health crisis in this country is going to erupt any time soon and it was all brought on by the government's fearmongering.","There's long been an illusion among people in the West that we could live beyond our means indefinitely. We would consume what the East produced on low wages. Globalisation would keep inflation under control and central banks could keep interest rates low forever. When things turned bad (financial crisis 2008 or pandemic 2020), central banks who hypothesised that they had largely mastered the economic cycle could manipulate rates, print money and bail out the financial system. This also allowed governments to fund ballooning budget deficits by, in effect, selling debt to their own central banks. The net effect? No one would suffer. Bankers could keep getting their bonuses. The ""poor"" could spend all day on their couches watching daytime television while gorging on benefits. Single mothers could create a brood by different fathers that the state had a duty to support. We would cut emissions and save the planet no less. Our hubris knew no bounds. Guess what? It's time to pay our bills...",0.142384335
49,Forum,Anonymous,2023,1,NewsForums,DiscussionForums,"Let's give these mask and lockdown advocates here the benefit of the doubt and assume that anybody capable of stringing a sentence together has enough brain function to know that these measures have always been known to be useless, in fact, there's very strong evidence they're harmful. They know this, so what are their motives for continuing to spread the myth? And why the ad hominem attacks on anyone questioning a narrative that's falling apart or even just repeating official data? It smacks of a desperate Custer's Last Stand by the bad actors who've been employed by shady organisations, unfortunately for them, they're left with blunt knives and damp squibs at a gunfight. Let's hope we can search the bodies for identification later.","Aloci9.... not waffling.... that is the reality. Had you have been further forward in your savings and mortgage criteria qualification 2, 3, or 4 years ago you would have realised your dream, bought your own house and now be in the same situation that thousands of people will find themselves. It is purely luck that means you were not ready 3 years ago. Or else you would be staring at losing your home too. I've seen it before. All the best.",0.020334037
50,Forum,Anonymous,2023,1,NewsForums,DiscussionForums,"Let's give these mask and lockdown advocates here the benefit of the doubt and assume that anybody capable of stringing a sentence together has enough brain function to know that these measures have always been known to be useless, in fact, there's very strong evidence they're harmful. They know this, so what are their motives for continuing to spread the myth? And why the ad hominem attacks on anyone questioning a narrative that's falling apart or even just repeating official data? It smacks of a desperate Custer's Last Stand by the bad actors who've been employed by shady organisations, unfortunately for them, they're left with blunt knives and damp squibs at a gunfight. Let's hope we can search the bodies for identification later.","JAYG. Not luck, purposeful decision making! I was brought up not to take debt on in any form. And still are you telling me I should be ashamed that I'm happy mt savings are getting some returns?? I haven't said anything about other peoples positions, just I'm happy I'll finally see higher rates on my savings lol. And just to add, it was okay for people to be happy about the extortionate amount their houses were increasing every year! But I'm supposed to be ashamed of my savings!",0.040278729
51,Forum,Anonymous,2023,1,NewsForums,DiscussionForums,"I went out to a restaurant the last Saturday in September and by the Wednesday I tested positive for Covid. Initially I thought it was reasonably mild, but then I got worse,so much worse. It went to my. Chest and Im still coughing uncontrollably and wheezing. Some people are very Ill with Covid, its not mild for everyone! I did not report it and my husband and older son are suffering too.","Andrew Bailey.... pretty much a Johnson pick and ""yes"" man who at the Treasury Select Committee last May largely refused to answer any questions on Brexit's and the NIP's impact on the UK's finance and economy. What do you expect from a guy with those credentials....miracles?",0.005445411
52,Forum,Anonymous,2023,1,NewsForums,DiscussionForums,"Pfizer admitted that jabs were never tested to see if they stopped people catching covid. Covid tests are only 7% accurate because of all the false positives. Flu jabs can only be manufactured with the last variant of the flu and not the present mutation. A cold winter with orchestrated hikes in electricity and gas charges means people will die of the damp and the cold, especially as the NHS was deliberately taken apart so people can't get early treatment for most illnesses. They admitted that jabs have lowered people's immune systems with each shot (and of course they don't stop you catching and spreading covid), therefore leaving people at more risk if they take the jabs of catching anything that comes their way, especially if they are living in freezing conditions thanks to the Government who are making the excuse that it's the Ukraine war (it isn't, it's Agenda 21/30 Net Zero). Masks make people breathe back in their own bacteria and distancing stops immunity being build up.",Ive got no sympathy for those that over borrowed and now find themselves facing financial problems. I worked in a industry up until a couple of years ago that attracted individuals that had to have the latest iPhones and top spec cars. Zero sympathy. Ive always been frugal and dammed proud of that fact.,0.039668158
53,Forum,Anonymous,2023,1,NewsForums,DiscussionForums,"I never believed Covid was more than a bad cold or flu, I spent ""lockdown"" acting normal, seeing people and hugging etc, never so much as had a sniffle in the 2 years. And I'm classed as vulnerable. Got 2 Covid vaccines and then BAM....hit by Covid. What does that tell you? Perhaps the vaccine gives you Covid to keep you believing it's real and dangerous.","Savers who are rubbing their hands will probably be disappointed. Safe investments like savings accounts rarely make a profit. Indeed, youll be lucky to get an interest rate that that breaks even with inflation. When money devalues, things get pricier. I bought a second-hand Cortina in 1975 and traded it in, a wreck, in 1980. I got more for the trade-in than in originally paid for it. Thats high inflation.",0.187773868
